{
  "$schema": "https://json-schema.org/draft/2020-12/schema",
  "$id": "https://optees.org/schemas/simulator/v2/round.v2.json",
  "title": "DeferredRoundRecord",
  "description": "Immutable execution record of a single simulation round under deferred settlement with timestamps, observation hashes, policy round records, and state Merkle hash.",
  "type": "object",
  "required": [
    "$type",
    "schema_version",
    "round_id",
    "run_id",
    "round_index",
    "parent_round_hash",
    "knowledge_cutoff",
    "execution_start_time",
    "execution_end_time",
    "effective_time",
    "eligible_observation_hashes",
    "policy_round_records",
    "state_merkle_hash"
  ],
  "additionalProperties": false,
  "properties": {
    "$type": {
      "type": "string",
      "const": "round"
    },
    "schema_version": {
      "type": "string",
      "const": "2.0.0"
    },
    "round_id": {
      "type": "string",
      "pattern": "^rnd_[a-zA-Z0-9_-]+$"
    },
    "run_id": {
      "type": "string",
      "pattern": "^ep-run_[a-zA-Z0-9_-]+$"
    },
    "round_index": {
      "type": "integer",
      "minimum": 0
    },
    "parent_round_hash": {
      "type": [
        "string",
        "null"
      ],
      "pattern": "^sha256:[a-f0-9]{64}$"
    },
    "knowledge_cutoff": {
      "type": "string",
      "pattern": "^\\d{4}-\\d{2}-\\d{2}T\\d{2}:\\d{2}:\\d{2}(\\.\\d+)?Z$"
    },
    "execution_start_time": {
      "type": "string",
      "pattern": "^\\d{4}-\\d{2}-\\d{2}T\\d{2}:\\d{2}:\\d{2}(\\.\\d+)?Z$"
    },
    "execution_end_time": {
      "type": "string",
      "pattern": "^\\d{4}-\\d{2}-\\d{2}T\\d{2}:\\d{2}:\\d{2}(\\.\\d+)?Z$"
    },
    "effective_time": {
      "type": "string",
      "pattern": "^\\d{4}-\\d{2}-\\d{2}T\\d{2}:\\d{2}:\\d{2}(\\.\\d+)?Z$"
    },
    "eligible_observation_hashes": {
      "type": "array",
      "items": {
        "type": "string",
        "pattern": "^sha256:[a-f0-9]{64}$"
      }
    },
    "policy_round_records": {
      "type": "array",
      "minItems": 1,
      "items": {
        "type": "object",
        "required": [
          "policy_id",
          "account_state_before_hash",
          "account_state_after_hash",
          "pending_before",
          "pending_after",
          "settlement_outcome_hash",
          "deferred_transition_hash",
          "proposed_decision_hash",
          "decision_outcome_hash",
          "optees_call_receipt_hashes"
        ],
        "additionalProperties": false,
        "properties": {
          "policy_id": {
            "type": "string",
            "pattern": "^pol-def_[a-zA-Z0-9_-]+$"
          },
          "account_state_before_hash": {
            "type": "string",
            "pattern": "^sha256:[a-f0-9]{64}$"
          },
          "account_state_after_hash": {
            "type": "string",
            "pattern": "^sha256:[a-f0-9]{64}$"
          },
          "pending_before": {
            "type": [
              "object",
              "null"
            ],
            "required": [
              "pending_transition_hash",
              "admission_account_hash",
              "expected_open_time",
              "settlement_deadline"
            ],
            "additionalProperties": false,
            "properties": {
              "pending_transition_hash": {
                "type": "string",
                "pattern": "^sha256:[a-f0-9]{64}$"
              },
              "admission_account_hash": {
                "type": "string",
                "pattern": "^sha256:[a-f0-9]{64}$"
              },
              "expected_open_time": {
                "type": "string",
                "pattern": "^\\d{4}-\\d{2}-\\d{2}T\\d{2}:\\d{2}:\\d{2}(\\.\\d+)?Z$"
              },
              "settlement_deadline": {
                "type": "string",
                "pattern": "^\\d{4}-\\d{2}-\\d{2}T\\d{2}:\\d{2}:\\d{2}(\\.\\d+)?Z$"
              }
            }
          },
          "pending_after": {
            "type": [
              "object",
              "null"
            ],
            "required": [
              "pending_transition_hash",
              "admission_account_hash",
              "expected_open_time",
              "settlement_deadline"
            ],
            "additionalProperties": false,
            "properties": {
              "pending_transition_hash": {
                "type": "string",
                "pattern": "^sha256:[a-f0-9]{64}$"
              },
              "admission_account_hash": {
                "type": "string",
                "pattern": "^sha256:[a-f0-9]{64}$"
              },
              "expected_open_time": {
                "type": "string",
                "pattern": "^\\d{4}-\\d{2}-\\d{2}T\\d{2}:\\d{2}:\\d{2}(\\.\\d+)?Z$"
              },
              "settlement_deadline": {
                "type": "string",
                "pattern": "^\\d{4}-\\d{2}-\\d{2}T\\d{2}:\\d{2}:\\d{2}(\\.\\d+)?Z$"
              }
            }
          },
          "settlement_outcome_hash": {
            "type": [
              "string",
              "null"
            ],
            "pattern": "^sha256:[a-f0-9]{64}$"
          },
          "deferred_transition_hash": {
            "type": [
              "string",
              "null"
            ],
            "pattern": "^sha256:[a-f0-9]{64}$"
          },
          "proposed_decision_hash": {
            "type": [
              "string",
              "null"
            ],
            "pattern": "^sha256:[a-f0-9]{64}$"
          },
          "decision_outcome_hash": {
            "type": [
              "string",
              "null"
            ],
            "pattern": "^sha256:[a-f0-9]{64}$"
          },
          "optees_call_receipt_hashes": {
            "type": "array",
            "items": {
              "type": "string",
              "pattern": "^sha256:[a-f0-9]{64}$"
            }
          }
        }
      }
    },
    "state_merkle_hash": {
      "type": "string",
      "pattern": "^sha256:[a-f0-9]{64}$"
    }
  }
}
